{
 "schema_version": "1",
 "run_id": "20261028T061540-40593406639.1",
 "business_date": "2026-10-28",
 "started_at": "2026-10-28T06:15:40+08:00",
 "finished_at": "2026-10-28T06:16:54+08:00",
 "trigger": {
  "event": "schedule",
  "schedule": "17 2 * * *",
  "scheduled_for": "2026-10-28T02:17:00+08:00",
  "delay_minutes": 238.7
 },
 "code_version": "e5d70a7b62163785e734d5575230a08e376e8778",
 "config_sha256": "7daf5d4275f35b433c2b04dcace71868be8f3b3547d78d798ee1e12c4f0fcbe0",
 "complete": true,
 "sources": [
  {
   "source_id": "all-daily",
   "kind": "trending",
   "url": "https://github.com/trending?since=daily",
   "period": "daily",
   "status": "ok",
   "http_status": 200,
   "rows": 11,
   "error": null
  },
  {
   "source_id": "all-weekly",
   "kind": "trending",
   "url": "https://github.com/trending?since=weekly",
   "period": "weekly",
   "status": "ok",
   "http_status": 200,
   "rows": 13,
   "error": null
  },
  {
   "source_id": "python-daily",
   "kind": "trending",
   "url": "https://github.com/trending/python?since=daily",
   "period": "daily",
   "status": "ok",
   "http_status": 200,
   "rows": 15,
   "error": null
  },
  {
   "source_id": "python-weekly",
   "kind": "trending",
   "url": "https://github.com/trending/python?since=weekly",
   "period": "weekly",
   "status": "ok",
   "http_status": 200,
   "rows": 12,
   "error": null
  },
  {
   "source_id": "typescript-daily",
   "kind": "trending",
   "url": "https://github.com/trending/typescript?since=daily",
   "period": "daily",
   "status": "ok",
   "http_status": 200,
   "rows": 18,
   "error": null
  },
  {
   "source_id": "typescript-weekly",
   "kind": "trending",
   "url": "https://github.com/trending/typescript?since=weekly",
   "period": "weekly",
   "status": "ok",
   "http_status": 200,
   "rows": 20,
   "error": null
  },
  {
   "source_id": "zh-daily",
   "kind": "trending",
   "url": "https://github.com/trending?since=daily&spoken_language_code=zh",
   "period": "daily",
   "status": "ok",
   "http_status": 200,
   "rows": 20,
   "error": null
  },
  {
   "source_id": "zh-weekly",
   "kind": "trending",
   "url": "https://github.com/trending?since=weekly&spoken_language_code=zh",
   "period": "weekly",
   "status": "ok",
   "http_status": 200,
   "rows": 22,
   "error": null
  },
  {
   "source_id": "new-30d",
   "kind": "search",
   "url": "https://api.github.com/search/repositories",
   "query": "created:>=2026-09-28 stars:>=50 fork:false archived:false",
   "status": "ok",
   "http_status": 200,
   "rows": 100,
   "total_count": 4817,
   "incomplete_results": false,
   "error": null
  },
  {
   "source_id": "new-7d",
   "kind": "search",
   "url": "https://api.github.com/search/repositories",
   "query": "created:>=2026-10-21 stars:>=20 fork:false archived:false",
   "status": "ok",
   "http_status": 200,
   "rows": 100,
   "total_count": 1436,
   "incomplete_results": false,
   "error": null
  }
 ],
 "source_hits": [
  {
   "source_id": "all-daily",
   "rank": 1,
   "repo_id": 1315788496,
   "full_name": "elayadesign/ai-design-skills",
   "period_stars": 1395,
   "page_stars": 9174
  },
  {
   "source_id": "all-daily",
   "rank": 2,
   "repo_id": 1222917575,
   "full_name": "Nutlope/hallmark",
   "period_stars": 2859,
   "page_stars": 38856
  },
  {
   "source_id": "all-daily",
   "rank": 3,
   "repo_id": 1332461149,
   "full_name": "nightly-labs/openbot",
   "period_stars": 794,
   "page_stars": 2354
  },
  {
   "source_id": "all-daily",
   "rank": 4,
   "repo_id": 1073224795,
   "full_name": "obra/superpowers",
   "period_stars": 608,
   "page_stars": 306366
  },
  {
   "source_id": "all-daily",
   "rank": 5,
   "repo_id": 1097346685,
   "full_name": "pbakaus/impeccable",
   "period_stars": 1458,
   "page_stars": 90410
  },
  {
   "source_id": "all-daily",
   "rank": 6,
   "repo_id": 1309102418,
   "full_name": "makecindy/cindy",
   "period_stars": 1446,
   "page_stars": 7415
  },
  {
   "source_id": "all-daily",
   "rank": 7,
   "repo_id": 664013991,
   "full_name": "gitroomhq/postiz-app",
   "period_stars": 953,
   "page_stars": 39275
  },
  {
   "source_id": "all-daily",
   "rank": 8,
   "repo_id": 1136590548,
   "full_name": "affaan-m/ECC",
   "period_stars": 1183,
   "page_stars": 290809
  },
  {
   "source_id": "all-daily",
   "rank": 9,
   "repo_id": 1124219907,
   "full_name": "HKUDS/DeepTutor",
   "period_stars": 1587,
   "page_stars": 45738
  },
  {
   "source_id": "all-daily",
   "rank": 10,
   "repo_id": 1293238217,
   "full_name": "JetBrains/thinkrail",
   "period_stars": 1211,
   "page_stars": 3906
  },
  {
   "source_id": "all-daily",
   "rank": 11,
   "repo_id": 1273646780,
   "full_name": "togg53192-cmd/jailbreaks",
   "period_stars": 890,
   "page_stars": 5418
  },
  {
   "source_id": "all-weekly",
   "rank": 1,
   "repo_id": 1273427276,
   "full_name": "cloudflare/security-audit-skill",
   "period_stars": 16593,
   "page_stars": 50063
  },
  {
   "source_id": "all-weekly",
   "rank": 2,
   "repo_id": 1140828898,
   "full_name": "anthropics/knowledge-work-plugins",
   "period_stars": 2822,
   "page_stars": 33405
  },
  {
   "source_id": "all-weekly",
   "rank": 3,
   "repo_id": 1152014594,
   "full_name": "AgriciDaniel/claude-seo",
   "period_stars": 2546,
   "page_stars": 22694
  },
  {
   "source_id": "all-weekly",
   "rank": 4,
   "repo_id": 1142983825,
   "full_name": "multica-ai/andrej-karpathy-skills",
   "period_stars": 3286,
   "page_stars": 225447
  },
  {
   "source_id": "all-weekly",
   "rank": 5,
   "repo_id": 909213664,
   "full_name": "TauricResearch/TradingAgents",
   "period_stars": 3437,
   "page_stars": 117268
  },
  {
   "source_id": "all-weekly",
   "rank": 6,
   "repo_id": 1200597263,
   "full_name": "Graphify-Labs/graphify",
   "period_stars": 7183,
   "page_stars": 136925
  },
  {
   "source_id": "all-weekly",
   "rank": 7,
   "repo_id": 995029641,
   "full_name": "ruvnet/ruflo",
   "period_stars": 2683,
   "page_stars": 79770
  },
  {
   "source_id": "all-weekly",
   "rank": 8,
   "repo_id": 975734319,
   "full_name": "anomalyco/opencode",
   "period_stars": 5070,
   "page_stars": 222347
  },
  {
   "source_id": "all-weekly",
   "rank": 9,
   "repo_id": 1183888342,
   "full_name": "stablyai/orca",
   "period_stars": 9241,
   "page_stars": 107987
  },
  {
   "source_id": "all-weekly",
   "rank": 10,
   "repo_id": 1183263320,
   "full_name": "android/skills",
   "period_stars": 823,
   "page_stars": 9907
  },
  {
   "source_id": "all-weekly",
   "rank": 11,
   "repo_id": 1246148135,
   "full_name": "akitaonrails/ai-memory",
   "period_stars": 2838,
   "page_stars": 14062
  },
  {
   "source_id": "all-weekly",
   "rank": 12,
   "repo_id": 1153130349,
   "full_name": "pingdotgg/t3code",
   "period_stars": 1881,
   "page_stars": 30806
  },
  {
   "source_id": "all-weekly",
   "rank": 13,
   "repo_id": 160919119,
   "full_name": "fastapi/fastapi",
   "period_stars": 1066,
   "page_stars": 104158
  },
  {
   "source_id": "python-daily",
   "rank": 1,
   "repo_id": 1124219907,
   "full_name": "HKUDS/DeepTutor",
   "period_stars": 1587,
   "page_stars": 45739
  },
  {
   "source_id": "python-daily",
   "rank": 2,
   "repo_id": 1301657572,
   "full_name": "superdesigndev/treg",
   "period_stars": 261,
   "page_stars": 6383
  },
  {
   "source_id": "python-daily",
   "rank": 3,
   "repo_id": 1152014594,
   "full_name": "AgriciDaniel/claude-seo",
   "period_stars": 712,
   "page_stars": 22694
  },
  {
   "source_id": "python-daily",
   "rank": 4,
   "repo_id": 1165277268,
   "full_name": "Panniantong/Agent-Reach",
   "period_stars": 1623,
   "page_stars": 104871
  },
  {
   "source_id": "python-daily",
   "rank": 5,
   "repo_id": 909213664,
   "full_name": "TauricResearch/TradingAgents",
   "period_stars": 1702,
   "page_stars": 117268
  },
  {
   "source_id": "python-daily",
   "rank": 6,
   "repo_id": 1172273835,
   "full_name": "SnailSploit/Claude-Red",
   "period_stars": 257,
   "page_stars": 9622
  },
  {
   "source_id": "python-daily",
   "rank": 7,
   "repo_id": 1187630119,
   "full_name": "NVIDIA/SkillSpector",
   "period_stars": 932,
   "page_stars": 22723
  },
  {
   "source_id": "python-daily",
   "rank": 8,
   "repo_id": 4165675,
   "full_name": "smicallef/spiderfoot",
   "period_stars": 43,
   "page_stars": 23900
  },
  {
   "source_id": "python-daily",
   "rank": 9,
   "repo_id": 1206390571,
   "full_name": "debpalash/VoiceStudio",
   "period_stars": 2601,
   "page_stars": 91199
  },
  {
   "source_id": "python-daily",
   "rank": 10,
   "repo_id": 1185590488,
   "full_name": "rohitg00/ai-engineering-from-scratch",
   "period_stars": 529,
   "page_stars": 74674
  },
  {
   "source_id": "python-daily",
   "rank": 11,
   "repo_id": 1238120057,
   "full_name": "ayghri/i-have-adhd",
   "period_stars": 182,
   "page_stars": 59049
  },
  {
   "source_id": "python-daily",
   "rank": 12,
   "repo_id": 1285974683,
   "full_name": "HKUDS/AutoSwarm",
   "period_stars": 41,
   "page_stars": 2032
  },
  {
   "source_id": "python-daily",
   "rank": 13,
   "repo_id": 266417772,
   "full_name": "SimplifyJobs/Summer2027-Internships",
   "period_stars": 22,
   "page_stars": 48190
  },
  {
   "source_id": "python-daily",
   "rank": 14,
   "repo_id": 1222953295,
   "full_name": "NVIDIA/auto-ontology",
   "period_stars": 75,
   "page_stars": 329
  },
  {
   "source_id": "python-daily",
   "rank": 15,
   "repo_id": 58028038,
   "full_name": "521xueweihan/HelloGitHub",
   "period_stars": 287,
   "page_stars": 185002
  },
  {
   "source_id": "python-weekly",
   "rank": 1,
   "repo_id": 1140828898,
   "full_name": "anthropics/knowledge-work-plugins",
   "period_stars": 2822,
   "page_stars": 33405
  },
  {
   "source_id": "python-weekly",
   "rank": 2,
   "repo_id": 1152014594,
   "full_name": "AgriciDaniel/claude-seo",
   "period_stars": 2546,
   "page_stars": 22694
  },
  {
   "source_id": "python-weekly",
   "rank": 3,
   "repo_id": 909213664,
   "full_name": "TauricResearch/TradingAgents",